{
  "@context": {
    "@base": "https://elian0609.github.io/sensado-vehicular/id/",
    "sosa": "http://www.w3.org/ns/sosa/",
    "xsd": "http://www.w3.org/2001/XMLSchema#",
    "proy": "https://elian0609.github.io/sensado-vehicular/vocab#",
    "sensor_id": "@id",
    "hosted_by": {
      "@id": "sosa:isHostedBy",
      "@type": "@id"
    },
    "sensor_model": "proy:sensorModel",
    "sensor_type": "proy:sensorType",
    "calibration_params": {
      "@id": "proy:calibrationParams",
      "@type": "@json"
    },
    "install_date": {
      "@id": "proy:installDate",
      "@type": "xsd:date"
    },
    "status": "proy:status"
  },
  "@type": "sosa:Sensor",
  "sensor_id": "ppd42ns_01",
  "hosted_by": "moto_01",
  "sensor_model": "PPD42NS",
  "sensor_type": "particulate_matter",
  "calibration_params": {
    "voltage_divider_r1_ohm": 1000,
    "voltage_divider_r2_ohm": 2000
  },
  "install_date": "2026-10-05",
  "status": "activo"
}
